代碼,商品,漲幅%,產業地位,細產業,股本,市值
6134,萬旭,0.9,主要經營極細銅軸線、天線、信號線等線材業者,連接線材,8.19,27.5
6156,松上,1.03,印刷電路板和磁性元件製造商,印刷電路板,10.79,21.2
6158,禾昌,-0.81,3C用連接器生產廠,連接器,5.57,10.2
6173,信昌電,9.84,華新科旗下的MLCC及瓷粉原料供應商,MLCC,17.12,230.5
6174,安碁,1.22,台灣三大石英元件廠之一,石英元件,5,20.8
6175,立敦,0.44,立隆電旗下的被動元件上游鋁箔製造廠,被動元件上游,15.01,103
6185,幃翔,0.72,生產各類應用連接器,連接器,14.99,20.9
6194,育富,-0.15,台灣印刷電路板製造業者,印刷電路板,4.8,15.5
6203,海韻電,8.42,台灣以PC高階應用為主之交換式電源供應器廠商,電源供應器,8.24,61.6
6204,艾華,-0.54,國內利基型被動元件大廠,電阻,2.31,16.9
6207,雷科,7.39,主/被動元件設備及材料供應商,設備儀器商,7.98,54.5
6210,慶生,1.74,台灣中小型的多層PCB廠,印刷電路板,3.5,7.2
6217,中探針,6.02,台灣第一家探針及探針式連接器製造廠,探針、探針卡,11.72,330.5
6220,岳豐,-0.17,主要生產區域網路線材，並延伸至終端產品生產廠商,連接線材,14.65,43.9
6259,百徽,9.98,主要代理電磁波防制元件和電源相關元件,電子元件代理商,2.81,6.9
6266,泰詠,-1.43,台灣專業SMT加工及組裝測試廠商,電子製造服務,15.39,42.4
6274,台燿,6.2,全球前十大銅箔基板廠之一,銅箔基板,29.14,4202.2
6275,元山,-5.26,知名散熱風扇大廠,散熱風扇馬達,8.02,40.4
6279,胡連,-2.82,兩岸最大汽車端子製造商,汽車端子,11.9,143.4
6284,佳邦,0.61,電子保護元件及天線產品之領導廠商,天線,14.9,122.2
6290,良維,-0.36,全球知名電源線及充電器轉接頭製造商,連接線材,16.95,466.9
6292,迅德,7.51,專注生產工業用變壓器產品之廠商,變壓器,4.66,26
6418,詠昇,-1.57,各種應用之訊號連接器及傳輸線製造商,連接器,3.45,10.8
6432,今展科,9.95,專業之電感供應商,電感,3.44,16.7
6538,倉和,-1.38,國內最大的太陽能精密網版廠,電子其他,3.81,29.8
6584,南俊國際,2.69,專業鋼珠滑軌之製造廠商,其他電子零件,7.09,485.4
6597,立誠,9.97,一詮轉投資之LED陶瓷基板廠,LED散熱基板,3,22.5
6642,富致,-0.16,台灣PPTC自復式保險絲製造商,熱敏電阻,3.74,24
6664,群翊,-0.79,全球最大PCB塗佈烘烤設備廠商,PCB相關設備,6.08,267.2
6727,亞泰金屬,-1.79,全球知名的銅箔基板高階含浸設備製造商,PCB相關設備,2.69,133.1
6761,穩得,1.94,國內知名的EMC一站式服務商,電子元件代理商,3.5,73.4
6821,聯寶,-1.96,主要從事變壓器及電感器等磁性元件製造,變壓器,3.26,16.4
6913,鴻呈,0.77,全球線纜製造組裝規劃供應商,連接線材,4.38,57.2
6967,汎瑋材料,-0.52,電子功能性材料製造商兼經銷商,其他電子零件,2.49,18.9
7744,崴寶,-1.95,機構整合解決方案服務商,模具沖壓,3.2,177
8038,長園科,-3.49,氧化鋰鐵電池模組系統應用生產商,工業用電池,6.23,26.7
8042,金山電,5.71,MB、SPS、CRT用之鋁質電解電容器大廠,鋁質電解電容,12.95,115.1
8043,蜜望實,-5.68,主要代理太陽誘電之積層陶瓷電容及電感,電子元件代理商,7.99,67.7
8071,能率網通,0.3,專精事務機塑膠機構件及隱形眼鏡之生產業務,模具沖壓,6.01,10.1
8074,鉅橡,1.1,全球最大PCB墊板供應商,PCB材料,8.7,72.2
8093,保銳,-1.79,主攻高階DIY市場且經營自有品牌之電源與電腦週邊廠,電源供應器,5.66,7
8109,博大,-1.26,台灣專攻工業與通訊應用之利基型電源廠,電源供應器,8.22,96.9
8121,越峰,9.9,台聚旗下、台灣最大錳鋅系列鐵芯等電感類製造商,被動元件上游,21.3,72.1
8147,正淩,9.71,生產PC、工業及通信用的連接器廠商,連接器,4.17,70.3
8155,博智,-5.41,仁寶旗下工業及商業用PCB廠,印刷電路板,6.16,254.9
8182,加高,-5.32,日本大真空轉投資，為台灣石英元件製造商,石英元件,10.7,40
8289,泰藝,2.36,台灣專業石英振盪器製造商,振盪器,6.83,34.1
8291,尚茂,9.89,台灣利基型銅箔基板廠,銅箔基板,1.75,6.8
8358,金居,1.65,台灣前三大電解銅箔製造商,銅箔,25.26,1167
2347,聯強,5.11,亞太最大、全球前三大3C產品通路商,電腦通路商,166.79,1441.1
2414,精技,-2.04,台灣前三大資訊通路經營商,電腦通路商,16.17,77.5
2430,燦坤,-0.75,全台最大3C連鎖通路,3C通路商,11.68,23.1
3010,華立,1.87,大中華半導體前段製程材料與化學品最大供應商,電子元件代理商,25.94,352.8
3028,增你強,-5.39,台灣半導體元件代理通路商,IC零組件通路商,23.72,179.1
3033,威健,0.34,半導體零組件專業代理商,IC零組件通路商,48.53,211.5
3036,文曄,9.98,台灣前三大半導體IC通路商,IC零組件通路商,126.91,3347.1
3048,益登,6.13,全球第十大半導體代理商,IC零組件通路商,26.98,110.2
3055,蔚華科,9.65,半導體測試解決方案商,封測用設備,11.5,98.7
3209,全科,10,為專業通訊元件設計及通路商,IC零組件通路商,23.54,142.4
3312,弘憶股,6.59,IC通路商，主要代理數位通訊應用方案與元件,IC零組件通路商,18.26,81.3
3528,安馳,-9.34,台灣前5大IC通路商,IC零組件通路商,6.66,55
3702,大聯大,0.44,全球暨亞太區第一大的半導體零組件通路商,IC零組件通路商,168.23,1914.1
5434,崇越,1.89,日本信越晶圓產品在台代理商,半導體材料通路商,19.37,829
6189,豐藝,-1.63,國內專業的電子零組件經銷通路商,IC零組件通路商,26.46,127.1
6281,全國電,0.98,台灣知名家電與3C通路賣場,電器銷售,9.92,51.1
6776,展碁國際,-0.34,台灣第二大電子通路代理商,電腦通路商,9.16,53.2
8070,長華*,0.1,半導體封裝材料及設備通路商,半導體材料通路商,7.26,350.1
8072,陞泰,-2.61,從事安全監控系統及半導體代理業務,安全監控,8,22.4
8112,至上,-2.8,主要代理品牌以Samsung為主之IC通路商,IC零組件通路商,52.53,456
3224,三顧,-2.2,經營電子材料代理及再生醫療業務,電子元件代理商,7.82,33
3232,昱捷,0.24,主要代理日系的電子零組件通路商,IC零組件通路商,4.66,9.7
3360,尚立,3.56,代理影像感測元件和專注於網通設備和服務的企業,IC零組件通路商,7.64,11.1
3444,利機,0.22,國內半導體封測材料通路商,半導體材料通路商,4.5,40.1
6113,亞矽,-0.2,歐美半導體零件的專業代理商,IC零組件通路商,5.25,12.9
6118,建達,-1.71,3C電腦周邊產品代理通路商,電腦通路商,9.09,15.7
6154,順發,-1.16,台灣大型的3C量販零售通路商,3C通路商,8.01,10.3
6227,茂綸,2.49,日Macnica集團旗下電子通路大廠,IC零組件通路商,7.61,78.4
6265,方土昶,2.83,記憶體元件代理及保健食品銷售商,IC零組件通路商,11.82,53.7
6270,倍微,-1.27,半導體電子零組件代理及韌體服務,IC零組件通路商,7.21,19.7
6474,華豫寧,-3.75,主要代理MCU及電子鎖廠商,IC零組件通路商,5.25,20.2
8032,光菱,2.19,瑞薩、三菱等日系原廠產品在台代理商,IC零組件通路商,5.18,21.7
8067,志旭,-4.23,光電資訊產品及美妝商品之專業代理商,電腦通路商,2.07,2.6
8068,全達,1.08,大宇資旗下的IC零組件通路商,IC零組件通路商,8.08,19
8084,巨虹,-1.43,經營記憶體通路及餐飲、助聽器等產品,電子元件代理商,6.95,31.1
8096,擎亞,2.5,為韓國三星在台之主要合作夥伴,IC零組件通路商,14.93,146.8
2427,三商電,1.16,以金融、電訊與交通產業為主之系統整合商,系統整合,19.8,43.2
2453,凌群,0.37,以金融業為主的系統整合大廠,系統整合,10,54.8
2468,華經,-4.47,以數位影像處理為主的系統整合商,系統整合,7,23.9
2471,資通,-2.64,以金融業及製造業為主的系統整合廠商,系統整合,4.73,24.4
2480,敦陽科,1.01,台灣資訊系統整合服務大廠,系統整合,10.64,159
3029,零壹,0.81,台灣大型加值型網路代理商,軟體通路／代理,16.7,153.6
4994,傳奇,0.1,台灣知名遊戲開發商,PC遊戲,6.64,65.1
5203,訊連,-1.37,全球知名多媒體影音軟體公司,套裝軟體,7.94,51.3
6112,邁達特,-0.23,資訊應用軟硬體服務供應中介之加值型通路商,系統整合,18.84,54.1
6183,關貿,-0.76,台灣政務相關應用軟體業者,電商服務,15,138
6214,精誠,1.2,金融服務、科技整合及加值服務系統業者,系統整合,27.22,345.7
3147,大綜,1.12,電腦軟硬體設備代理銷售及系統整合商,系統整合,4.37,79.1
3158,嘉實,-0.22,金融資訊流整合系統及股市即時報價供應商,應用軟體,3.05,27.1
3570,大塚,5.41,工程繪圖CAD/CAM/CAE/CAID軟體代理商,軟體通路／代理,1.71,30
4953,緯軟,-2.07,緯創旗下，台灣大型資訊委外服務廠商,軟體業,7.31,86.7
5201,凱衛,0.49,以證券金融服務為主的系統整合商,系統整合,3.87,11.8
5202,力新,0,台灣影像處理軟體商,套裝軟體,8.91,11.6
5210,寶碩,-0.89,證券金融相關解決方案系統整合廠商,系統整合,8.22,22.8
5211,蒙恬,0.74,台灣手寫辨識軟硬體廠商,手寫板,3.2,6.5
5212,凌網,2.89,以知識管理為主的系統整合廠,系統整合,3.46,16.6
5310,天剛,0,金融系統整合廠,系統整合,2.89,7.5
5403,中菲,-0.32,金融與物流業系統整合、軟體服務之廠商,系統整合,7.82,72.4
5410,國眾,0.82,大眾控轉投資系統整合廠,系統整合,9.24,34.1
6123,上奇,-0.44,電腦軟硬體、OA產品及耗材代理商,軟體通路／代理,6.21,28.3
6140,訊達,-7.1,以金融、資訊、媒體、半導體產業為主的系統整合商,系統整合,5.49,11.9
6148,驊宏資,-4.43,金融及公共事業SI廠,系統整合,4.66,14.1
6221,晉泰,-3.94,電子商務系統整合廠商,系統整合,16.86,41.1
6231,系微,-1.86,NB及IA產品的BIOS廠商,BIOS,4.57,144.3
6240,松崗,0,專注協助企業數位服務與轉型領域,系統整合,2.29,4.2
6516,勤崴國際,0.17,中華電旗下台灣最大圖資公司,應用軟體,5.63,33
6590,普鴻,-0.14,台灣金融支付加解密解決方案最大供應商,系統整合,2.5,17.3
6593,台灣銘板,-0.57,專業信用卡製卡廠商,智慧卡相關,3.19,11.2
6697,東捷資訊,0,東元旗下ERP整合規劃廠,企業資源規劃,2.73,11.3
6751,智聯服務,-1.2,宏碁旗下IT規劃整合及服務廠,系統整合,2.22,11
6752,叡揚,0,企業e化應用軟體開發與服務廠,應用軟體,3.71,38.3
6791,虎門科技,1.67,CAE、CPC導入暨顧問諮詢服務廠,系統整合,2.08,25.4
6874,倍力,-8.99,資通轉投資之企業軟體代理及開發廠,軟體通路／代理,2.2,18.7
6884,海柏特,-1.45,宏碁旗下資訊產品售後服務提供商,商業服務／顧問,1.84,6.2
7767,仁大資訊,0,一站式全方位資訊服務系統整合廠商,系統整合,3.01,13.3
8099,大世科,-0.49,大同旗下資訊通信系統整合廠商,系統整合,10.01,61
8272,全景軟體,2.5,緯創旗下，專注身份認證的資訊安全軟體公司,資訊安全,1.9,14.8
8284,三竹,-0.16,金融服務軟體供應商,應用軟體,4.73,30.3
8416,實威,1.45,3D CAD/CAM/CAE/PDM軟硬體代理商,軟體通路／代理,2.82,49.4
2312,金寶,6.98,金寶集團旗下消費性電子代工廠,電子製造服務,150.58,450.1
2317,鴻海,0.8,全球最大EMS電子專業代工廠,電子製造服務,1402.86,35288.6
2354,鴻準,0.33,鴻海旗下散熱模組及鋁鎂合金廠,鎂鋁合金,141.45,871.3
2359,所羅門,2.51,電子零組件專業代理商,電子元件代理商,17.15,210.1
2360,致茂,5.83,全球知名的自動測試設備品牌大廠,量測儀器,42.52,10035.8
2373,震旦行,-0.7,台灣最大的辦公設備與辦公家俱通路商,辦公用品設備,23.62,133.2
2390,云辰,-0.85,從事智慧安防系統及智慧控制系統業務,安全監控,19.26,18.1
2404,漢唐,0.99,台積電最大的無塵室供應商,廠務工程,19.06,1953.5
2423,固緯,-7.31,台灣知名的電子量測儀器廠,量測儀器,14.5,88.3
2433,互盛電,-0.44,日本理光辦公事務機器之台灣代理商,事務機器,14.45,65.8
2459,敦吉,0,經營通路、製造、驗證三大事業群,電子元件代理商,10.56,70.4
2461,光群雷,-3.33,全球重要知名雷射全像材料整合供應商,電子其他,19.19,27.9
2464,盟立,-1.64,台灣工業自動化設備廠,面板設備,20.64,247.6
2474,可成,1.46,台灣知名的金屬機殼製造大廠,鎂鋁合金,56.14,1167.6
2477,美隆電,0.71,台灣最大音箱及揚聲器製造廠之一,音響設備及零件,15.86,33.5
2482,連宇,0.3,台灣讀卡機等電子支付交易設備廠,IC讀卡機,7.79,13
2488,漢平,1.16,台灣娛樂音訊產品ODM製造商,音響設備及零件,8,42
3018,隆銘綠能,5.42,台灣無塵室及工廠、住宅機電系統整合工程之大廠,廠務工程,7.54,4.2
3030,德律,1.93,電路板組裝檢測設備大廠,PCB相關設備,23.62,937.8
3043,科風,-0.98,不斷電系統和電力保護產品品牌廠商,UPS,3.9,7.9
3305,昇貿,1.74,半導體封裝材料之錫膏、錫球生產商,金、錫凸塊,14.46,169.2
3518,柏騰,2.78,為台灣第一家具備低溫真空濺鍍之專業廠商,機殼表面處理,10.36,36.1
3617,碩天,2.79,北美地區UPS市場前三大品牌之一,UPS,9.48,191.9
3665,貿聯-KY,5.64,Tesla電池線束主力供應商,連接線材,19.51,5667
4585,達明,3.79,全球第二大協作型機器人製造商,協作機器人,10.46,357.8
4588,玖鼎電力,-0.68,國內智慧電表大廠,儀表,4.3,25.1
5225,東科-KY,-1.34,全球最大影音揚聲器OEM製造商,音響設備及零件,7.91,58.1
6139,亞翔,-4.9,台灣無塵室及機電系統整合服務等製造商,廠務工程,23.56,1599.6
6192,巨路,3.23,程控儀錶與電子材料通路商,設備儀器商,9.62,123.1
6196,帆宣,3.66,專注於設備工程及耗材代理的廠商,廠務工程,22.03,936.4
6201,亞弘電,-1.28,音訊及小家電ODM大廠,音響設備及零件,8.92,44.6
6215,和椿,6.7,專業的自動化設備零組件、光電製程之工業製造商,自動化設備,8.28,98.9
6283,淳安,-2.14,鍵盤導電薄膜與車載鏡頭製造商,鍵盤,14.9,33.9
6409,旭隼,-6.94,台灣UPS及PV Inverter之ODM製造廠商,UPS,8.77,670.1
6438,迅得,0.29,主要為PCB相關之自動化設備供應商,PCB相關設備,8.22,140.6
6558,興能高,3.25,以穿載式應用為主的鋰電池廠商,消費用電池,9.38,26.1
6658,聯策,9.97,電路板外觀檢測領域知名企業,PCB相關設備,3.64,64.2
6691,洋基工程,-1.68,高科技廠房無塵室統包及節能工程服務商,廠務工程,12.15,781.2
6698,旭暉應材,-5.17,高精細金屬遮罩、微波及半導體零件生產商,其他電子零件,6.64,20.7
6722,輝創,-0.86,汽車電裝配備製造廠,倒車雷達,8.84,35.7
6743,安普新,0.5,音樂娛樂或電競用耳機製造商,耳機,15,44.9
6830,汎銓,-4.19,半導體材料分析服務龍頭,檢測驗證服務,5.34,390.4
8021,尖點,6.98,全球前三大PCB鑽針生產商之一,雷射鑽孔機、鑽頭,14.57,622.2
8201,無敵,0.39,英業達轉投資電子辭典公司,消費性電子產品,6.24,8
8499,鼎炫-KY,-1.06,電子衡器及EMI導電材料生產商,其他電子零件,4.12,114.9
1785,光洋科,-4.79,全球最大硬碟靶材供應商,其他半導體耗材,59.6,947.6
3067,全域,--,以Phonic為品牌行銷全球之專業音響廠商,音響設備及零件,2,3.5
3093,港建*,0.51,PCB、IC封裝及CD-R/DVD製程設備廠,PCB相關設備,3.63,86.4
3131,弘塑,5.1,酸槽設備在台市占率第一名,封測用設備,2.97,904.1
3219,倚強科,9.9,全球領先的消費電子及車電測試方案供應商,設備儀器商,7.18,53.8
3285,微端,-0.85,數位影音產品與LCD模組製造商,音響設備及零件,4.27,12.4
3289,宜特,3.42,台灣半導體驗證分析大廠,檢測驗證服務,8.67,157.4
3303,岱稜,0,全球前三大的燙金箔領導商,電子其他,9.41,48.9
3324,雙鴻,0.47,台灣前二大散熱模組廠商,筆記型電腦用散熱模組,9.31,995.9
3373,熱映,0,主營紅外線精密量測技術產品,體溫計,4.76,8
3402,漢科,0.36,專注於特殊氣體輸配工程設備廠商,廠務工程,7.3,101.9
3465,進泰電子,1.45,專業音響OEM/ODM製造商,音響設備及零件,3.53,9.9
3498,陽程,9.63,台灣PCB暨CCL、環境工程及物流等自動化設備廠,PCB相關設備,6.13,62.8
3508,位速,-4.55,手機外殼電鍍、濺鍍與塗裝之表面處理專業廠,機殼表面處理,10.43,21.9
3541,西柏,-0.43,台灣專業智慧型影音訊號產品製造商,視訊轉換相關,5.63,13
3552,同致,0.73,全球知名倒車雷達大廠,倒車雷達,9.79,53.9
3580,友威科,9.23,台灣真空設備與真空濺鍍供應商,設備儀器商,3.95,38.3
3587,閎康,9.87,以材料分析為主之專業獨立實驗室,檢測驗證服務,7.12,243.1
3628,盈正,-0.3,UPS設備製造商兼專案工程商,UPS,4.5,30.3
3663,鑫科,-5.83,屬中鋼集團之台灣前兩大濺鍍靶材廠,其他半導體耗材,10.85,73.7
4554,橙的,0.16,胎壓偵測器在北美市佔率達7%以上,胎壓監測系統,2.63,8
4577,達航科技,-1.76,台灣PCB鑽孔代工和設備廠商,雷射鑽孔機、鑽頭,4.91,68.5
4760,勤凱,-2.78,台灣被動元件、太陽能導電漿料大廠,被動元件上游,3.22,90
5452,佶優,4.51,全球塑膠粒及PCR環保塑膠原料整合平台商,電子元件代理商,14.88,50
5489,彩富,-1.11,台灣網路視訊安全監控系統專業代工廠,安全監控,10.27,41.1
5493,三聯,1.29,感測、監測系統整合服務商,量測儀器,4.37,37.8
5536,聖暉*,4.19,以無塵室工程為主，並跨足機電系統整合服務廠商,廠務工程,6.2,1111.8
6146,耕興,-1.84,國內最具規模之手機及網通專業認證實驗室,檢測驗證服務,10.19,217.5
6151,晉倫,5.26,台灣汽車複合材料供應商,複合材料,5.53,21.6
6512,啟發電,-0.52,專業影音訊號延長器、分配器及處理器廠商,視訊轉換相關,2.53,4.8
6613,朋億*,-2.04,聖暉旗下，經營半導體廠務設備製造,設備儀器商,3.89,187.1
6654,天正國際,1.45,專業的被動元件自動化生產設備商,設備儀器商,3.73,37.2
6667,信紘科,0.38,高科技廠務工程及製程設備領域之專業廠商,設備儀器商,4.93,129.4
6725,矽科宏晟,-0.92,化學藥品供應系統的領導商,設備儀器商,3.71,120.3
6735,美達科技,-1.19,半導體類比暨混合訊號IC測試設備知名廠商,IC檢測設備,4.62,57.7
6739,竹陞科技,8.68,半導體智能化系統整合廠,設備儀器商,2.34,336.9
6840,東研信超,1.69,電子設備及電子產品的測試技術服務商,檢測驗證服務,3.08,20.3
6855,數泓科,0.96,台灣數位手工具領導者,手工具,2.32,24.4
6877,鏵友益,-1.81,國內半導體及光電產業之檢測功能自動化設備供應商,IC檢測設備,4.7,76.6
6903,巨漢,-4.03,無塵室及機電空調之統包工程廠商,廠務工程,6.67,270
7703,銳澤,0.48,朋億旗下，高科技產業廠務及製程設備廠商,設備儀器商,3.47,73.1
7728,光焱科技,-2.38,光電子晶片(PIC)檢測大廠,IC檢測設備,1.39,108.2
7792,安葆,-2.02,提供能源運用規劃及電力系統規劃解決方案,重電設備,4.67,147.5
8047,星雲,-0.74,世界知名的電腦割字機製造大廠,設備儀器商,4.17,22.3
8085,福華,-1.22,大同集團旗下電子零組件廠,其他電子零件,14,17
8092,建暐,-0.55,IC封裝模具及量測儀器廠製造商,量測儀器,5.72,10.3
8183,精星,-1.71,專業電子製造服務(EMS)廠商,電子製造服務,12.13,38.4
8431,匯鑽科,0.33,亞太知名表面處理大廠,機殼表面處理,4.88,29.7
8455,大拓-KY,7.5,國內知名的電機、電子零組件代理經銷商,電子元件代理商,2.52,7
1316,上曜,2.23,上曜集團旗下豪宅品牌,營建,40.16,42.2
1436,華友聯,-0.31,主打首購族及換屋族市場的建商,營建,19.42,94.6
1438,三地開發,6.11,開發以台南及高雄地區為主力的建商,營建,11.12,24.1
1439,雋揚,-0.74,國揚集團旗下，著重開發危老及都更計畫,營建,9.2,24.5
1442,名軒,-0.74,麗寶集團旗下成員,營建,36.62,98.5
1453,大將,-0.43,主要經營營建開發及紡織買賣,營建,11.32,13.1
1456,怡華,3.17,元邦集團旗下，為綜合性紡織廠及營建商,營建,9.37,13.7
1472,三洋實業,-0.33,承建公共工程、商辦、住宅等營造工程,基礎建設,5.25,47.7
1805,寶徠,-4.19,知名建案「寶徠花園廣場」建商,營建,13.5,13.9
1808,潤隆,1.58,興富發集團旗下建商,營建,89.3,258.1
2442,新美齊,0.8,著重於高質感不動產開發,營建,32.52,61.1
2501,國建,-1.52,屬霖園集團之台灣老牌營建開發業者,營建,115.96,262.6
2504,國產,0.14,台灣知名預拌混凝土大廠,預拌混凝土,118,410.6
2505,國揚,-0.56,整合百貨、飯店、休閒、地產的營建商,營建,38,67.1
2506,太設,-1.03,多角化經營建設、百貨及休閒等事業,營建,38.7,33.5
2509,全坤建,-1.49,推案集中於大台北地區的建商,營建,22.46,29.6
2511,太子,0.13,統一集團旗下建商,營建,162.33,126.9
2515,中工,0.76,威京集團旗下，建築工程廠商,基礎建設,160.79,212.2
2516,新建,-1.14,主要承攬公共工程為主之營造廠商,基礎建設,22.63,29.5
2520,冠德,1.83,大台北地區的中大型建商,營建,60.95,186.5
2524,京城,-0.14,高雄地區知名建商,營建,36.6,134.7
2527,宏璟,-0.87,日月光旗下建商,營建,27.03,92.9
2528,皇普,0.22,以大台北地區推案為主的建商,營建,43.6,97.2
2530,華建,-1.4,推案集中於大台北地區的建商,營建,84.13,178.3
2534,宏盛,0,宏泰集團旗下建商，以仁愛帝寶豪宅推案而知名,營建,47.42,88.9
2535,達欣工,0.27,台灣主要甲級營造廠之一,住宅建設,27.08,201.5
2536,宏普,-0.73,推案集中於大台北地區之建商,營建,33.28,68.2
2537,聯上發,0,聯上集團旗下負責大台北及桃園地區推案的建商,營建,30.06,30.8
2538,基泰,-1.61,推案集中於大台北地區之建商,營建,44.5,43.6
2539,櫻花建,1.02,推案集中於大台中地區之建商,營建,119.31,474.3
2540,愛山林,0.39,甲山林旗下建商及代銷商,房屋代銷,94.49,486.6
2542,興富發,4.13,台灣前十大推案建商,營建,217.31,905.1
2543,皇昌,2.49,主要承攬公共工程之營造廠,基礎建設,52.85,228.6
2545,皇翔,0,推案集中於大台北地區建商，知名推案為皇翔御琚,營建,37.97,147.9
2546,根基,-0.23,冠德旗下，住宅及土木工程營造廠,住宅建設,13.05,111.2
2547,日勝生,-0.49,以政府開發案起家，橫跨建築、百貨及觀光的中型建商,營建,103.51,106.1
2548,華固,4.86,大台北地區中型建商，並轉向地上權開發,營建,31.97,414
2597,潤弘,2.56,潤泰集團旗下，營造廠商,住宅建設,31.07,497.1
2923,鼎固-KY,-1.42,日月光轉投資的房地產開發商,營建,174.03,484.7
3052,夆典,0.47,提供工程整合服務之廠商,營建,23.32,25
3056,富華新,1.12,推案集中於中部地區之建商,營建,48.06,65.1
3266,昇陽,-1.45,推案集中於大台北地區之建商,營建,35.23,47.7
3703,欣陸,0.24,由大陸建設換股成立之建設、營造控股公司,基礎建設,82.32,170.8
5515,建國,-3.38,建築統包工程服務商,住宅建設,20.16,77.8
5519,隆大,-0.45,綜合營造及住宅大樓開發商,營建,21.92,72.2
5521,工信,4.76,台灣前十大營造廠,基礎建設,49.23,59.6
5522,遠雄,3.86,以營建地產、休閒娛樂為核心的企業集團,營建,78.16,568.2
5525,順天,-0.43,台中地區建商,營建,31.81,74.4
5531,鄉林,-0.83,推案以中部地區為主之建商，並跨足觀光旅館經營,營建,97.76,82.1
5533,皇鼎,-0.36,主要於大台北地區推案的建商,營建,28.52,39.9
5534,長虹,1.28,以廠辦及住宅開發案為主之建商,營建,31.53,250.4
5546,永固-KY,-1.21,大陸重慶地區預拌混凝土領導廠商,預拌混凝土,8.24,13.5
6177,達麗,0.53,推案集中於林口、竹北、高雄等地，近年業務拓展至美國西雅圖,營建,47.19,222
9906,欣巴巴,0,高雄巴巴集團旗下建商,營建,9.04,32.7
9946,三發地產,2.79,全心投控轉投資公司，以都會區為主要開發標的,營建,32.66,54.2
2596,綠意,1.9,桃園及台北地區小型建商,營建,10,29.5
2718,全心投控,-1.2,由飯店業跨入不動產開發產業,營建,8.76,36.1
3188,鑫龍騰,-1.03,以開發南部不動產商品為主,營建,18.86,45.5
3489,森寶,1.13,森聯旗下，房地產開發商,住宅建設,9.05,20.3
3512,皇龍,0.74,從事營建事業及散熱片設計製造,營建,11.31,23
3521,台鋼建設,-3.28,從事營建及POS機系統業務,營建,14.58,19.3
4113,聯上,-0.67,聯上集團旗下負責南部推案的建商,營建,23.11,34.1
4416,三圓,-0.8,從事國民住宅興建及出租出售業務,營建,7.36,9.2
4907,富宇,5.91,富宇建設集團成員之一，針對竹科及中科週邊進行開發,營建,11.81,46.6
5206,坤悅,0.82,推案集中於台中地區之建商,營建,17.15,42
5213,亞昕,-0.39,推案集中於大台北地區之建商,營建,72.13,186.5
5324,士開,0.94,仰德集團旗下之建設、飯店業者,營建,22.64,24.2
5455,昇益,-4.26,從事不動產開發興建及不動產租賃業務,營建,6.55,16.2
5508,永信建,1.32,高雄建商，以成屋銷售為主,營建,21.74,108.2
5511,德昌,-1.41,商辦大樓、高科技廠房及公共工程等為營業項目之營造商,住宅建設,11.34,79.2
5512,力麒,-0.72,力麗集團旗下建商、環衛營造商,營建,76.63,53
5514,三豐,-2.25,以都市更新為主之建商,營建,23.61,35.9
5516,雙喜,1.87,承攬各項公共、建築及土木工程之營造廠,住宅建設,5.15,5.6
5520,力泰,-0.12,台灣預拌混凝土製造加工廠,預拌混凝土,6,48.6
5523,豐謙,0,嘉義地區建商,營建,15.5,47
